<?xml version="1.0" encoding="utf-8" ?>
<users xmlns:xsi="http://www.w3.org/2001/XMLSchema-instance"
         xsi:noNamespaceSchemaLocation="user.xsd">
	<user type="client">
		<accountInfo>
			<ID>209221</ID>
			<username>ann</username>
			<password>ann</password>
		</accountInfo>
	</user>
	<user type="client">
		<accountInfo>
			<ID>209222</ID>
			<username>eli</username>
			<password>eli</password>
		</accountInfo>
	</user>
	<user type="admin">
		<accountInfo>
			<ID>100001</ID>
			<username>tim</username>
			<password>tim</password>
		</accountInfo>
	</user>
</users>